A1: MFC-MUTE (0.0.7) language files support

A1: MFC-MUTE LANGUAGE FEATURES
A2: HOW TO ADD A NEW LANGUAGE SUPPORT ?
A3: MFC-MUTE STRINGS LIST
A4: Sample language file

A2: MFC-MUTE LANGUAGE FEATURES
A3: MFC-MUTE comes with 7 embedded languages : English - German - Italian - French - Spanish - Danish - Lithuanian.
A4: Additional languages (provided that they are compatible with the ANSI character set) are supported through external language files.
A5: At start-up MFC-MUTE automatically searches for additional language files in its settings folder. Any file whose name ends with a .lng extension is considered as a language file.
A6: Every time a language file is found MFC-MUTE tries to associate an icon with it. The icon must have the same name as the language file (except the .ico extension).
A7: When a language is selected MFC-MUTE considers it as the new default language and automatically selects it at the next start-up.

A1: HOW TO ADD A NEW LANGUAGE SUPPORT ?
A2: What do you need ?
A3: A simple text editor is the only tool you really need. You can also use the LTH (Little Translation Helper) written by Markus Speckmeier.
A4: What are the rules regarding strings ?
A5: You just need to keep in mind these 3 points :
A6: 1 : " character is a delimiter. Only strings found between inverted quotes are used by MFC-MUTE. Two inverted quotes by line are the standard format.
A7: 2: Don't change the ordinal range of strings in the language file.
A8: 3: Write only one language string by line
A9: Examples of correct syntax :
A10: "string"
A11: 1 "string"
A12: string "string"
A13: IDS_STRING "string"
A14: "string1" "string2" (*)
A16: (*) 4 "delimiters are supported too but only string2 will be considered as a language string by MFC-MUTE.
A17: Comments and blank lines : You can add comments and blank lines provided you don't use extra " delimiter characters.
A18: Escape sequences : You can use \n & \r . \" is not supported
A19: You have completed the translation ?
A20: Bravo ! Just save your work in a file and copy it in the MFC-MUTE settings folder. The filename extension must be .lng
A21: Please note that the name of your file (without the extension) will be considered as being the name of the language you are adding.
A22: Example : \ ...\MFC-MUTE\settings\spanish.lng | B22: appears as spanish in the language combo
A23: Ok. You want an icon too !
A24: No problem. Copy the icon of your choice it in the MFC-MUTE settings folder and give it the same name as the associated language.
A25: Example : \ ...\MFC-MUTE\settings\spanish.ico

A1: MFC-MUTE STRINGS LIST
A2: The following array lists all the strings used by MFC-MUTE Index - Resource identifiers and strings only figure here to help you. You don't need to copy them. The only thing you must take into account is to follow the same order in your own language file

A1: Index | B1: Resource identifier | C1: String
A2: 1 | B2: IDS_SEARCH_NORESULT_ENG | C2: No matching entry found.
A3: =+A2+1 -> 2 | B3: IDS_GEN_KEY_PAIR_WINDOW_TITLE_ENG | C3: First Startup
A4: =+A3+1 -> 3 | B4: IDS_GEN_KEY_PAIR_WINDOW_MAIN_TEXT_ENG | C4: Generating a key pair.\nThis may take a while.
A5: =+A4+1 -> 4 | B5: IDS_KEY_LENGTH_WINDOW_TITLE_ENG | C5: First Startup
A6: =+A5+1 -> 5 | B6: IDS_KEY_LENGTH_WINDOW_MAIN_TEXT_ENG | C6: Key generation\nSelect a key size
A7: =+A6+1 -> 6 | B7: IDS_CONNECTIONS_TAB_ADDRESS_TEXT_ENG | C7: Address:
A8: =+A7+1 -> 7 | B8: IDS_CONNECTIONS_TAB_PORT_TEXT_ENG | C8: Port:
A9: =+A8+1 -> 8 | B9: IDS_CONNECTIONS_TAB_ADDHOST_BTN_TEXT_ENG | C9: &Add Host
A10: =+A9+1 -> 9 | B10: IDS_CONNECTIONS_TAB_STARTUP_ENG | C10: Starting Up.
A11: =+A10+1 -> 10 | B11: IDS_DLOADS_TAB_PURGE_INCOMING_ENG | C11: &Purge Incoming Folder
A12: =+A11+1 -> 11 | B12: IDS_DLOADS_TAB_EXPLORE_INCOMING_ENG | C12: E&xplore Incoming Files
A13: =+A12+1 -> 12 | B13: IDS_DLOADS_TAB_EXPLORE_SHARED_ENG | C13: &Explore Shared Files
A14: =+A13+1 -> 13 | B14: IDS_DLOADS_TAB_CLEAR_COMPLETE_ENG | C14: Clear Co&mpleted Download(s)
A15: =+A14+1 -> 14 | B15: IDS_DLOADS_TAB_CLEAR_FAILED_ENG | C15: &Clear Stalled/Failed Download(s)
A16: =+A15+1 -> 15 | B16: IDS_DLOADS_TAB_CANCEL_ENG | C16: Ca&ncel/Clear Selected Download(s)
A17: =+A16+1 -> 16 | B17: IDS_TAB_TITLE_SEARCH_TEXT_ENG | C17: Search
A18: =+A17+1 -> 17 | B18: IDS_TAB_TITLE_DLOAD_TEXT_ENG | C18: Downloads
A19: =+A18+1 -> 18 | B19: IDS_TAB_TITLE_ULOAD_TEXT_ENG | C19: Uploads
A20: =+A19+1 -> 19 | B20: IDS_TAB_TITLE_CONNECTIONS_TEXT_ENG | C20: Connections
A21: =+A20+1 -> 20 | B21: IDS_TAB_TITLE_SETTINGS_TEXT_ENG | C21: Settings
A22: =+A21+1 -> 21 | B22: IDS_TASK_TRAY_MENU_RESTORE_ENG | C22: &Restore
A23: =+A22+1 -> 22 | B23: IDS_TASK_TRAY_MENU_QUIT_ENG | C23: &Quit
A24: =+A23+1 -> 23 | B24: IDS_TRYING_TO_CONNECT_ENG | C24: Trying to connect to %s : %d
A25: =+A24+1 -> 24 | B25: IDS_BEHIND_FIREWALL_POPUP_CAPTION_ENG | C25: First Startup
A26: =+A25+1 -> 25 | B26: IDS_BEHIND_FIREWALL_QUESTION_ENG | C26: Are you behind a firewall that might\r\nblock inbound connections to MUTE?\r\n(If unsure, click Yes.)
A27: =+A26+1 -> 26 | B27: IDS_TRACE_STOPPING_FILE_SHARING_LAYER_ENG | C27: Stopping file sharing layer\n
A28: =+A27+1 -> 27 | B28: IDS_TRACE_SAVING_RANDOMNESS_ENG | C28: Saving randomness for use at next startup\n
A29: =+A28+1 -> 28 | B29: IDS_TRACE_STOPPING_MSG_ROUTER_ENG | C29: Stopping message routing layer\n
A30: =+A29+1 -> 29 | B30: IDS_TRACE_ALL_LAYERS_STOPPED_ENG | C30: All layers are stopped, exiting.\n
A31: =+A30+1 -> 30 | B31: IDS_TOOLTIP_EXPLORE_SHARED_FILES_ENG | C31: Explore Shared Files Directory
A32: =+A31+1 -> 31 | B32: IDS_TOOLTIP_EXPLORE_INCOMING_FILES_ENG | C32: Explore Incoming Files Directory
A33: =+A32+1 -> 32 | B33: IDS_TOOLTIP_PURGE_INCOMING_FILES_ENG | C33: Purge Incoming Files Directory
A34: =+A33+1 -> 33 | B34: IDS_DLOAD_FAILED_ENG | C34: Failed
A35: =+A34+1 -> 34 | B35: IDS_DLOAD_NOT_FOUND_ENG | C35: Not Found
A36: =+A35+1 -> 35 | B36: IDS_DLOAD_FILE_CORRUPTED_ENG | C36: File Corrupted
A37: =+A36+1 -> 36 | B37: IDS_DLOAD_CANCELLING_ENG | C37: Cancelling...
A38: =+A37+1 -> 37 | B38: IDS_DLOAD_COMPLETE_ENG | C38: Complete
A39: =+A38+1 -> 38 | B39: IDS_DLOAD_ONE_HUNDRED_PERCENT_OF_ENG | C39: 100% of
A40: =+A39+1 -> 39 | B40: IDS_DLOAD_ATTEMPTING_RESUME_ENG | C40: Attempting Resume...
A41: =+A40+1 -> 40 | B41: IDS_SHARING_FOLDER_DOES_NOT_EXIST_ENG | C41: Sharing folder does not exist.
A42: =+A41+1 -> 41 | B42: IDS_MUTE_ERROR_CAPTION_ENG | C42: Mute ERROR
A43: =+A42+1 -> 42 | B43: IDS_PURGE_INCOMING_CAPTION_ENG | C43: Purge unfinished downloads...
A44: =+A43+1 -> 43 | B44: IDS_PURGE_INCOMING_QUESTION_ENG | C44: Are you sure you want to purge all unfinished downloads?
A45: =+A44+1 -> 44 | B45: IDS_PURGE_INCOMING_CAPTION_ERROR_ENG | C45: MUTE Purge Incoming Directory Error...
A46: =+A45+1 -> 45 | B46: IDS_PURGE_INCOMING_ERROR_MSG_ENG | C46: Clear all downloads first!
A47: =+A46+1 -> 46 | B47: IDS_INCOMING_FOLDER_DOES_NOT_EXIST_ENG | C47: Incoming folder does not exist.
A48: =+A47+1 -> 47 | B48: IDS_512BITS_ENG | C48: 512 bits (weak, but fast)
A49: =+A48+1 -> 48 | B49: IDS_1024BITS_ENG | C49: 1024 bits (recommended)
A50: =+A49+1 -> 49 | B50: IDS_1536BITS_ENG | C50: 1536 bits (strong, but slow)
A51: =+A50+1 -> 50 | B51: IDS_2048BITS_ENG | C51: 2048 bits (very strong and very slow)
A52: =+A51+1 -> 51 | B52: IDS_4096BITS_ENG | C52: 4096 bits (probably overkill)
A53: =+A52+1 -> 52 | B53: IDS_KEY_GENERATION_SELECT_SIZE_ENG | C53: Key generation\nSelect a key size
A54: =+A53+1 -> 53 | B54: IDS_KEY_GENERATION_DLG_CAPTION_ENG | C54: First Startup
A55: =+A54+1 -> 54 | B55: IDS_GATHERING_RANDOMNESS_CAPTION_ENG | C55: Gathering Randomness
A56: =+A55+1 -> 55 | B56: IDS_GATHERING_RANDOMNESS_TEXT_ENG | C56: Encryption Seed -- Enter Some Randomness:\n(More Randomness => More Secure)
A57: =+A56+1 -> 56 | B57: IDS_KEY_GENERATION_TIME_TEXT_ENG | C57: Key generation took\n%d seconds
A58: =+A57+1 -> 57 | B58: IDS_MUTE_CLOSE_MSG_CAPTION_ENG | C58: MUTE Quitting
A59: =+A58+1 -> 58 | B59: IDS_MUTE_CLOSE_MSG_TEXT_ENG | C59: You have attempted to close MUTE\nwhile downloads are still active.\nDo you wish to continue closing MUTE?
A60: =+A59+1 -> 59 | B60: IDS_CONNECTIONS_COLHEADING_ADDRESS_ENG | C60: Address
A61: =+A60+1 -> 60 | B61: IDS_CONNECTIONS_COLHEADING_PORT_ENG | C61: Port
A62: =+A61+1 -> 61 | B62: IDS_CONNECTIONS_COLHEADING_SENT_ENG | C62: Sent
A63: =+A62+1 -> 62 | B63: IDS_CONNECTIONS_COLHEADING_QUEUED_ENG | C63: Queued
A64: =+A63+1 -> 63 | B64: IDS_CONNECTIONS_COLHEADING_DROPPED_ENG | C64: Dropped
A65: =+A64+1 -> 64 | B65: IDS_ADDHOST_ERROR_MSGBOX_CAPTION_ENG | C65: Mute Connections..
A66: =+A65+1 -> 65 | B66: IDS_ADDHOST_ERROR_MSGBOX_MSG_ENG | C66: Invalid ip address
A67: =+A66+1 -> 66 | B67: IDS_SEARCH_SEARCHING_STATUS_ENG | C67: Searching...
A68: =+A67+1 -> 67 | B68: IDS_SEARCH_IDLE_STATUS_ENG | C68: Idle...
A69: =+A68+1 -> 68 | B69: IDS_TOOLTIP_PURGE_HASH_FILES_ENG | C69: Purge Hash Files Directory
A70: =+A69+1 -> 69 | B70: IDS_ADDED_TO_DLOADS_PREFIX_ENG | C70: ++added to downloads++
A71: =+A70+1 -> 70 | B71: IDS_EXPORT_SEARCH_DLG_CAPTION_ENG | C71: Export Search Results...
A72: =+A71+1 -> 71 | B72: IDS_SEARCH_EXPORT_SEARCH_TEXT_TAG_ENG | C72: Search Text:
A73: =+A72+1 -> 72 | B73: IDS_SEARCH_EXPORT_SEARCH_BOOLEAN_TAG_ENG | C73: Search Boolean:
A74: =+A73+1 -> 73 | B74: IDS_SEARCH_BOOLEAN_AND_ENG | C74: AND
A75: =+A74+1 -> 74 | B75: IDS_SEARCH_BOOLEAN_OR_ENG | C75: OR
A76: =+A75+1 -> 75 | B76: IDS_SEARCH_BOOLEAN_ENTIRE_PHRASE_ENG | C76: ENTIRE PHRASE
A77: =+A76+1 -> 76 | B77: IDS_SEARCH_EXCLUDE_TEXT_ENG | C77: Search Exclude Text:
A78: =+A77+1 -> 77 | B78: IDS_SEARCH_FILE_SIZE_LIMITS_ENG | C78: File Size Limits (KB):
A79: =+A78+1 -> 78 | B79: IDS_SEARCH_FILE_SIZE_BOOLEAN_ENG | C79: File Size Boolean:
A80: =+A79+1 -> 79 | B80: IDS_SEARCH_BOOLEAN_ATLEAST_ENG | C80: AT LEAST
A81: =+A80+1 -> 80 | B81: IDS_SEARCH_BOOLEAN_ATMOST_ENG | C81: AT MOST
A82: =+A81+1 -> 81 | B82: IDS_SEARCH_EXPORT_FILE_COL_HEADINGS_ENG | C82: ----FILE NAME---- , ----FILE SIZE---- , ----HASH---- , ----HOST VIRTUAL ADDRESS----
A83: =+A82+1 -> 82 | B83: IDS_PURGE_HASHES_MSGBOX_CAPTION_ENG | C83: Purge your MUTE hashes...
A84: =+A83+1 -> 83 | B84: IDS_PURGE_HASHES_MSGBOX_TEXT_ENG | C84: Are you sure you want to purge your MUTE hashes?
A85: =+A84+1 -> 84 | B85: IDS_SEARCH_EXPORT_BUTTON_TEXT_ENG | C85: &Export Results
A86: =+A85+1 -> 85 | B86: IDS_SEARCH_DLOAD_BUTTON_TEXT_ENG | C86: &Download
A87: =+A86+1 -> 86 | B87: IDS_SEARCH_CLEARRESULTS_BUTTON_TEXT_ENG | C87: &Clear Results
A88: =+A87+1 -> 87 | B88: IDS_SEARCH_SEARCH_BUTTON_TEXT_ENG | C88: &Search
A89: =+A88+1 -> 88 | B89: IDS_SEARCH_STOP_BUTTON_TEXT_ENG | C89: S&top
A90: =+A89+1 -> 89 | B90: IDS_SEARCH_PURGE_HASH_BUTTON_TEXT_ENG | C90: &Purge Hash Folder
A91: =+A90+1 -> 90 | B91: IDS_SEARCH_SEARCHFOR_TEXT_ENG | C91: Search for these strings (separate words by space):
A92: =+A91+1 -> 91 | B92: IDS_SEARCH_SEARCHEXCLUDE_TEXT_ENG | C92: Exclude these strings (separate words by space):
A93: =+A92+1 -> 92 | B93: IDS_COL_HEADING_FILENAME_ENG | C93: File Name
A94: =+A93+1 -> 93 | B94: IDS_COL_HEADING_FILETYPE_ENG | C94: File Type
A95: =+A94+1 -> 94 | B95: IDS_COL_HEADING_SIZE_ENG | C95: Size
A96: =+A95+1 -> 95 | B96: IDS_COL_HEADING_HASH_ENG | C96: Hash
A97: =+A96+1 -> 96 | B97: IDS_COL_HEADING_HOST_VIP_ENG | C97: Host Virtual Address
A98: =+A97+1 -> 97 | B98: IDS_SEARCH_RT_CLK_MENU_CAPTION_ENG | C98: MUTE SEARCH...
A99: =+A98+1 -> 98 | B99: IDS_SEARCH_RT_CLK_MENU_DLOAD_ENG | C99: &Download
A100: =+A99+1 -> 99 | B100: IDS_DLOAD_EXPLORE_SHARED_BUTTON_ENG | C100: &Explore Shared Files
A101: =+A100+1 -> 100 | B101: IDS_DLOAD_EXPLORE_INCOMING_BUTTON_ENG | C101: E&xplore Incoming Files
A102: =+A101+1 -> 101 | B102: IDS_DLOAD_PURGE_INCOMING_BUTTON_ENG | C102: &Purge Incoming Folder
A103: =+A102+1 -> 102 | B103: IDS_DLOAD_CLEAR_COMPLETE_BUTTON_ENG | C103: Clear Co&mpleted Download(s)
A104: =+A103+1 -> 103 | B104: IDS_DLOAD_CLEAR_FAILED_BUTTON_ENG | C104: &Clear Stalled/Failed Download(s)
A105: =+A104+1 -> 104 | B105: IDS_DLOAD_CANCEL_BUTTON_ENG | C105: Ca&ncel/Clear Selected Download(s)
A106: =+A105+1 -> 105 | B106: IDS_COL_HEADING_STATUS_ENG | C106: Status
A107: =+A106+1 -> 106 | B107: IDS_COL_HEADING_NUMRESUMES_ENG | C107: # Resumes
A108: =+A107+1 -> 107 | B108: IDS_COL_HEADING_STARTTIME_ENG | C108: Start Time
A109: =+A108+1 -> 108 | B109: IDS_COL_HEADING_LASTUPDATETIME_ENG | C109: Last Status Update
A110: =+A109+1 -> 109 | B110: IDS_COL_HEADING_ROUTEQUALITY_ENG | C110: Route Quality
A111: =+A110+1 -> 110 | B111: IDS_DLOAD_RT_CLK_MENU_CAPTION_ENG | C111: MUTE DOWNLOADS...
A112: =+A111+1 -> 111 | B112: IDS_DLOAD_RT_CLK_MENU_CANCEL_ENG | C112: &Cancel
A113: =+A112+1 -> 112 | B113: IDS_DLOAD_RT_CLK_MENU_CLEAR_ENG | C113: C&lear
A114: =+A113+1 -> 113 | B114: IDS_DLOAD_RT_CLK_MENU_CLEARCOMPLETE_ENG | C114: Clear Co&mplete
A115: =+A114+1 -> 114 | B115: IDS_DLOAD_RT_CLK_MENU_REMOVESTALLED_ENG | C115: &Remove Stalled
A116: =+A115+1 -> 115 | B116: IDS_DLOAD_CANCELLED_ENG | C116: Cancelled...
A117: =+A116+1 -> 116 | B117: IDS_DLOAD_FETCHINGINFO_ENG | C117: Fetching file info...
A118: =+A117+1 -> 117 | B118: IDS_DLOAD_RESUMING_ENG | C118: Resuming download...
A119: =+A118+1 -> 118 | B119: IDS_DLOAD_ONE_HUNDRED_PERCENT_ENG | C119: 1
A120: =+A119+1 -> 119 | B120: IDS_DLOAD_FAILED_TO_WRITE_LOCAL_FILE_ENG | C120: Failed to Write Local File
A121: =+A120+1 -> 120 | B121: IDS_DLOAD_TIME_REMAINING_ENG | C121: %d%% of %s [%s/sec], %s remaining
A122: =+A121+1 -> 121 | B122: IDS_ULOAD_BTN_REMOVALL_ENG | C122: &Remove All Upload
A123: =+A122+1 -> 122 | B123: IDS_ULOAD_BTN_CANCELCLEAR_ENG | C123: &Cancel/Clear Selected Upload(s)
A124: =+A123+1 -> 123 | B124: IDS_ULOAD_LIST_STARTINGUP_ENG | C124: Starting Up
A125: =+A124+1 -> 124 | B125: IDS_ULOAD_STATUS_DONE_ENG | C125: Done
A126: =+A125+1 -> 125 | B126: IDS_ULOAD_STATUS_FAILED_ENG | C126: Failed
A127: =+A126+1 -> 126 | B127: IDS_ULOAD_STATUS_STALLED_ENG | C127: Stalled
A128: =+A127+1 -> 127 | B128: IDS_ULOAD_TIMEREMAINING_ENG | C128: %s remaining
A129: =+A128+1 -> 128 | B129: IDS_COL_HEADING_CHUNKSUPLOADED_ENG | C129: Chunks Uploaded
A130: =+A129+1 -> 129 | B130: IDS_COL_HEADING_DESTINATION_VIP_ENG | C130: Destination Virtual Address
A131: =+A130+1 -> 130 | B131: IDS_ULOAD_RT_CLK_MENU_CAPTION_ENG | C131: MUTE UPLOADS...
A132: =+A131+1 -> 131 | B132: IDS_ULOAD_RT_CLK_MENU_CANCEL_ENG | C132: &Cancel
A133: =+A132+1 -> 132 | B133: IDS_ULOAD_RT_CLK_MENU_REMOVEALL_ENG | C133: &Remove All
A134: =+A133+1 -> 133 | B134: IDS_SETTINGS_INBOUND_LIMIT_ENG | C134: Inbound Limit:
A135: =+A134+1 -> 134 | B135: IDS_SETTINGS_OUTBOUND_LIMIT_ENG | C135: Outbound Limit:
A136: =+A135+1 -> 135 | B136: IDS_SETTINGS_MSG_SEC_LIMIT_ENG | C136: msg/sec ( -1 == NO LIMIT )
A137: =+A136+1 -> 136 | B137: IDS_SETTINGS_INITIAL_DL_TIMEOUT_ENG | C137: Initial D/L Timeout (secs):
A138: =+A137+1 -> 137 | B138: IDS_SETTINGS_DELETE_CANCELED_DL_ENG | C138: Delete Canceled D/Ls:
A139: =+A138+1 -> 138 | B139: IDS_SETTINGS_MESSAGE_LIMIT_GROUP_ENG | C139: Message Limits Settings
A140: =+A139+1 -> 139 | B140: IDS_SETTINGS_DLOAD_SETTINGS_GROUP_ENG | C140: Download Settings
A141: =+A140+1 -> 140 | B141: IDS_SETTINGS_CONNECTIONS_GROUP_ENG | C141: Connection Settings
A142: =+A141+1 -> 141 | B142: IDS_SETTINGS_MAINTAIN_ATLEAST_ENG | C142: Maintain at least:
A143: =+A142+1 -> 142 | B143: IDS_SETTINGS_NEIGHBORCONNECTIONS_ENG | C143: neighbor connections
A144: =+A143+1 -> 143 | B144: IDS_SETTINGS_UPLOAD_CONTROLS_GROUP_ENG | C144: Upload Controls Settings
A145: =+A144+1 -> 144 | B145: IDS_SETTINGS_MAX_UPLOADS_ENG | C145: Maximum Uploads:
A146: =+A145+1 -> 145 | B146: IDS_SETTINGS_MAX_UPLOADS_PER_VIP_ENG | C146: Maximum Uploads Per VIP:
A147: =+A146+1 -> 146 | B147: IDS_BTN_BROWSE_ENG | C147: &Browse...
A148: =+A147+1 -> 147 | B148: IDS_SETTINGS_SHAREFILESFROM_ENG | C148: Share files from:
A149: =+A148+1 -> 148 | B149: IDS_SETTINGS_INCOMING_FOLDER_ENG | C149: Incoming D/Ls folder:
A150: =+A149+1 -> 149 | B150: IDS_SETTINGS_HASH_FOLDER_ENG | C150: Hash files folder:
A151: =+A150+1 -> 150 | B151: IDS_SETTINGS_SAVE_SETTINGS_BTN_ENG | C151: &Save Settings
A152: =+A151+1 -> 151 | B152: IDS_SETTINGS_WEB_GROUP_ENG | C152: Web Resources
A153: =+A152+1 -> 152 | B153: IDS_SETTINGS_ALLOW_ATMOST_ENG | C153: Allow at most
A154: =+A153+1 -> 153 | B154: IDS_NO_ENG | C154: NO
A155: =+A154+1 -> 154 | B155: IDS_YES_ENG | C155: YES
A156: =+A155+1 -> 155 | B156: IDS_SETTINGS_LANGUAGE_GROUP_ENG | C156: Language Settings
A157: =+A156+1 -> 156 | B157: IDS_BROWSE_SHARING_FOLDER_CAPTION_ENG | C157: Select MUTE Sharing Folder...
A158: =+A157+1 -> 157 | B158: IDS_BROWSE_INCOMING_FOLDER_CAPTION_ENG | C158: Select MUTE Incoming Folder...
A159: =+A158+1 -> 158 | B159: IDS_BROWSE_HASH_FOLDER_CAPTION_ENG | C159: Select MUTE Hash Folder...
A160: =+A159+1 -> 159 | B160: IDS_MUTE_SHARE_FOLDER_DOESNT_EXIST_ENG | C160: Sharing folder does not exist.
A161: =+A160+1 -> 160 | B161: IDS_MUTE_INCOMING_FOLDER_DOESNT_EXIST_ENG | C161: Incoming folder does not exist.
A162: =+A161+1 -> 161 | B162: IDS_MUTE_HASH_FOLDER_DOESNT_EXIST_ENG | C162: Hash folder does not exist.
A163: =+A162+1 -> 162 | B163: IDS_SETTINGS_LANGUAGERESTART_MSG_CAPTION_ENG | C163: Mute Language Settings
A164: =+A163+1 -> 163 | B164: IDS_SETTINGS_LANGUAGERESTART_MSG_TEXT_ENG | C164: Restart MUTE to use new language settings.
A165: =+A164+1 -> 164 | B165: IDS_DLOAD_QUEUE_ENG | C165: Queue
A166: =+A165+1 -> 165 | B166: IDS_DLOAD_QUEUED_ENG | C166: queued
A167: =+A166+1 -> 166 | B167: IDS_DLOAD_QUEUED_SEARCHING_ENG | C167: Queue searching...
A168: =+A167+1 -> 167 | B168: IDS_MUTE_HELP_ENG | C168: Help
A169: =+A168+1 -> 168 | B169: IDS_MUTE_ABOUT_ENG | C169: About MUTE
A170: =+A169+1 -> 169 | B170: IDS_TAB_TITLE_SHAREDFILES_TEXT_ENG | C170: Shared Files
A171: =+A170+1 -> 170 | B171: IDS_REFRESH_BUTTON_TEXT_ENG | C171: &Refresh
A172: =+A171+1 -> 171 | B172: IDS_SHARED_FILES_EXPORT_BUTTON_TEXT_ENG | C172: &Export List
A173: =+A172+1 -> 172 | B173: IDS_SHARED_FILES_EXPORT_DLG_CAPTION_TEXT_ENG | C173: Export List
A174: =+A173+1 -> 173 | B174: IDS_DLOAD_RT_CLK_MENU_SEARCH_QUEUE_ITEM_NEXT_ENG | C174: &Search Queue Item Next...
A175: =+A174+1 -> 174 | B175: IDS_UPLOADS_UPLOADS_SHOWING_LABEL_ENG | C175: # Uploads Showing:
A176: =+A175+1 -> 175 | B176: IDS_UPLOADS_TOTAL_CHUNKS_UPLOADED_LABEL_ENG | C176: Total Chunks Uploaded:
A177: =+A176+1 -> 176 | B177: IDS_SETTINGS_PORT_CHANGE_RESTART_TEXT_ENG | C177: Restart MUTE for Port Settings to take effect.
A178: =+A177+1 -> 177 | B178: IDS_SETTINGS_PORT_CHANGE_RESTART_CAPTION_ENG | C178: Mute Port Settings
A179: =+A177+1 -> 178 | B179: IDS_NOTCONNECTED_ENG | C179: Not Connected
A180: =+A177+1 -> 179 | B180: IDS_CONNECTED_ENG | C180: Connected
A181: =+A177+1 -> 180 | B181: IDS_UUSERS_ENG | C181: Users
A182: =+A177+1 -> 181 | B182: IDS_TRAFFIC_TEXT_ENG | C182: Stats:
A183: =+A177+1 -> 182 | B183: IDS_SEARCH_RESULTS_LBL_ENG | C183: Search Results...
A184: =+A177+1 -> 183 | B184: IDS_UPDOWN_ENG | C184: Up: %s | Down: %s
A185: =+A177+1 -> 184 | B185: IDS_MUTENET_ENG | C185: mute-net

A1: Sample language file (french) following the 1 "string" syntax
A2: 1 "Pas de rsultat trouv !"
A3: 2 "Premier dmarrage. "
A4: 3 "Gnration d'une paire de cls.\nMerci de patienter."
A5: 4 "Premier dmarrage."
A6: 5 "Gnrateur de cl\n Choisissez une longueur de cl."
A7: 6 "Adresse:"
A8: 7 "Port:"
A9: 8 "&Ajouter un hte."
A10: 9 "Dmarrage en cours."
A11: 10 "&Vider le rpertoire de tlchargement"
A12: 11 "E&xplorer les fichiers entrants"
A13: 12 "&Explorer les fichiers partags"
A14: 13 "Effacer le(s) tlchargement(s) termin(s)"
A15: 14 "&Effacer le(s) tlchargement(s) bloqu(s) ou en chec"
A16: 15 "Annuler et effacer le(s) tlchargement(s) slectionn(s)"
A17: 16 "Chercher"
A18: 17 "Tlchargements"
A19: 18 "Partags"
A20: 19 "Connexions"
A21: 20 "Prfrences"
A22: 21 "&Restaurer"
A23: 22 "&Quitter"
A24: 23 "Tentative de connexion %s : %d"
A25: 24 "Premier dmarrage"
A26: 25 "Etes-vous derrire un pare-feu qui pourrait\r\n bloquer les connexions entrantes ?\r\n(En cas doute, cliquez OUI.)"
A27: 26 "Arrt du partage de fichiers\n"
A28: 27 "Sauvegarde des donnes alatoires pour la prochaine utilisation\n"
A29: 28 "Arrt du routeur de messages\n"
A30: 29 "Tous les services sont stopps. Arrt imminent\n"
A31: 30 "Parcourir une fois le rpertoire des fichiers partags"
A32: 31 "Parcourir le rpertoire des fichiers tlchargs"
A33: 32 "Vider le rpertoire des fichiers tlchargs"
A34: 33 "Echec"
A35: 34 "Non trouv"
A36: 35 "Fichier corrompu"
A37: 36 "Annulation en cours..."
A38: 37 "Termin"
A39: 38 "100% de"
A40: 39 "Tentative de reprise..."
A41: 40 "Le rpertoire de fichiers partags n'existe pas."
A42: 41 "MUTE : : Erreur"
A43: 42 "Effacer les tlchargements en cours..."
A44: 43 "Etes-vous sr de vouloir effacer les tlchargements en cours ?"
A45: 44 "MUTE: Erreur d'effacement du rpertoire des fichiers tlchargs..."
A46: 45 "Annulez d'abord tous les tlchargements en cours !"
A47: 46 "Le rpertoire des fichiers tlchargs n'existe pas"
A48: 47 "512 bits (faible, mais rapide)"
A49: 48 "1024 bits (recommand)"
A50: 49 "1536 bits (fort, mais lent)"
A51: 50 "2048 bits (trs fort et trs lent)"
A52: 51 "4096 bits (dpassement de capacit probable)"
A53: 52 "Cration de cl\nChoisissez une taille de cl"
A54: 53 "Premier dmarrage"
A55: 54 "Saisie d'une srie alatoire"
A56: 55 "Srie alatoire -- Entrez des caractres alatoirement:\n(Plus il y a d'lments -> plus la srie est sre)"
A57: 56 "La cl a t gnre en \n%d secondes"
A58: 57 "MUTE est en cours de fermeture"
A59: 58 "Vous avez tent de quitter MUTE\n alors que des tlchargements sont en cours.\nVoulez-vous vraiment arrter MUTE ?"
A60: 59 "Adresse"
A61: 60 "Port"
A62: 61 "Envoy"
A63: 62 "En attente"
A64: 63 "Abandonn"
A65: 64 "Connexions de MUTE"
A66: 65 "Adresse IP invalide"
A67: 66 "Recherche en cours..."
A68: 67 "Inactif..."
A69: 68 "Purger le rpertoire de hachage"
A70: 69 "++ajout aux tlchargements++"
A71: 70 "Enregistrer les rsultats..."
A72: 71 "Rechercher le texte :"
A73: 72 "Recherche boolenne:"
A74: 73 "ET"
A75: 74 "OU"
A76: 75 "TOUT LE TEXTE"
A77: 76 "Exclure le texte:"
A78: 77 "Taille max fichiers (kb)"
A79: 78 "Boulen taille fichier"
A80: 79 "AU MOINS"
A81: 80 "AU PLUS"
A82: 81 "----FICHIER---- , ----TAILLE---- , ----HACHAGE---- , ----ADRESSE HOTE VIRTUEL----"
A83: 82 "Purger les hachages MUTE..."
A84: 83 "Etes-vous sr de vouloir purger les hachages MUTE ?"
A85: 84 "&Enregistrer tout"
A86: 85 "&Tlcharger"
A87: 86 "&Effacer les rsultats"
A88: 87 "&Chercher"
A89: 88 "A&rrter"
A90: 89 "&Purger le rpertoire de hachage"
A91: 90 "Rechercher ces mots-cls (sparez-les par des espaces):"
A92: 91 "Exclure ces mots-cls (sparez-les par des espaces):"
A93: 92 "Fichier"
A94: 93 "Type"
A95: 94 "Taille"
A96: 95 "Hachage"
A97: 96 "Adresse virtuelle de l'hte"
A98: 97 "RECHERCHE MUTE..."
A99: 98 "&Tlchargement"
A100: 99 "&Parcourir les fichiers partags"
A101: 100 "P&arcourir les fichiers tlchargs"
A102: 101 "&Purger les fichiers tlchargs"
A103: 102 "Effacer le(s) tlchargement(s) termin(s)"
A104: 103 "&Effacer le(s) tlchargement(s) bloqu(s) ou en chec"
A105: 104 "A&nnuler le(s) tlchargement(s) selectionn(s)"
A106: 105 "Statut"
A107: 106 "# Reprises"
A108: 107 "Heure de dbut "
A109: 108 "Dernire mise jour"
A110: 109 "Qualit d'acheminement"
A111: 110 "MUTE : TELECHARGEMENT..."
A112: 111 "&Annuler"
A113: 112 "E&ffacer"
A114: 113 "Effacement termin"
A115: 114 "&Supprimer le(s) tlchargement(s) arrt(s)"
A116: 115 "Annul..."
A117: 116 "Recherche des infos fichier..."
A118: 117 "Reprise du tlchargement..."
A119: 118 "100%"
A120: 119 "Erreur d'criture du fichier local"
A121: 120 "%d%% de %s [%s/sec], %s restant(es)"
A122: 121 "&Supprimer tous les partages en cours"
A123: 122 "&Annuler/Effacer le(s) partages(s) slectionn(s)"
A124: 123 "Dmarrage"
A125: 124 "Termin"
A126: 125 "Echec"
A127: 126 "Bloqu"
A128: 127 "%s restant"
A129: 128 "Tronons tlchargs"
A130: 129 "Adresse virtuelle de destination"
A131: 130 "MUTE : PARTAGEs..."
A132: 131 "&Annuler"
A133: 132 "&Supprimer tout"
A134: 133 "Entres autorises :"
A135: 134 "Partages autoriss :"
A136: 135 "msg/sec ( -1 == PAS DE LIMITE )"
A137: 136 "Initial D/L Timeout (secs):"
A138: 137 "Effacer les oprations annules:"
A139: 138 "Prfrences messages"
A140: 139 "Prfrences tlchargements"
A141: 140 "Prfrences connexion"
A142: 141 "Maintenir au moins:"
A143: 142 "connexions voisinnage"
A144: 143 "Prfrences partage"
A145: 144 "Nb max de partages:"
A146: 145 "Nb max partages VIP:"
A147: 146 "&Parcourir..."
A148: 147 "Rpertoire de partage:"
A149: 148 "Rpertoire doc entrants:"
A150: 149 "Rpertoire de hachage:"
A151: 150 "&Valider les prfrences"
A152: 151 "Ressources internet"
A153: 152 "Autoriser au maximum"
A154: 153 "NON"
A155: 154 "OUI"
A156: 155 "Langues"
A157: 156 "Slection du rpertoire des fichiers partags MUTE..."
A158: 157 "Slection du rpertoire des fichiers entrants MUTE..."
A159: 158 "Slection du rpertoire de hachage MUTE..."
A160: 159 "Le rpertoire de fichiers partags n'existe pas."
A161: 160 "Le rpertoire de fichiers entrants n'existe pas."
A162: 161 "Le rpertoire de hachage n'existe pas."
A163: 162 "Changement de langue"
A164: 163 "La modification de la langue prendra effet au prochain dmarrage de MUTE"
A165: 164 "Attente"
A166: 165 "Mise en attente"
A167: 166 "Recherche la file d'attente"
A168: 167 "Aide"
A169: 168 "A propos de MUTE"
A170: 169 "Fichiers Partags"
A171: 170 "&Mettre la liste jour"
A172: 171 "&Exporter la liste"
A173: 172 "Exporter la liste de fichiers partags"
A174: 173 "&Item suivant dans la file de recherche"
A175: 174 "# envois montrs:"
A176: 175 "Total tronons envoy:"
A177: 176 "La modification de 'PORT' prendra effet au prochain dmarrage de MUTE:"
A178: 177 "Changement de Port:"
A179: 178 "Non Connect"
A180: 179 "Connect"
A181: 180 "Utilisateurs"
A182: 181 "Stats:"
A183: 182 "Les rsultats de Recherche..."
A184: 183 "E: %s | R: %s"
A185: 184 "mute-net"